lim-18-7-2-001	18.7.2 Operational Limits: APU bleed + electrical load?	APU bleed + electrical load: max altitude 10,000 feet.	B737 AOM Rev 9.0	Ch 18 §18.7.2 Operational Limits		unverified common limits verbatim
lim-18-7-2-002	18.7.2 Operational Limits: APU bleed?	APU bleed: max altitude 17,000 feet.	B737 AOM Rev 9.0	Ch 18 §18.7.2 Operational Limits		unverified common limits verbatim
lim-18-7-2-003	18.7.2 Operational Limits: APU electrical load?	APU electrical load: max altitude 41,000 feet.	B737 AOM Rev 9.0	Ch 18 §18.7.2 Operational Limits		unverified common limits verbatim
lim-18-7-2-004	18.7.2 Operational Limits: APU Bleed Valve APU bleed valve must be closed when?	APU Bleed Valve APU bleed valve must be closed when:	B737 AOM Rev 9.0	Ch 18 §18.7.2 Operational Limits		unverified common limits
lim-18-7-2-005	18.7.2 Operational Limits: Ground air is connected, and isolation valve is open?	Ground air is connected, and isolation valve is open	B737 AOM Rev 9.0	Ch 18 §18.7.2 Operational Limits		unverified common limits
lim-18-7-2-006	18.7.2 Operational Limits: Engine No.1 bleed valve is open?	Engine No.1 bleed valve is open	B737 AOM Rev 9.0	Ch 18 §18.7.2 Operational Limits		unverified common limits verbatim
lim-18-7-2-007	18.7.2 Operational Limits: Isolation valve and engine No. 2 bleed valves are open?	Isolation valve and engine No. 2 bleed valves are open APU bleed valve may be open during engine start, but avoid engine power above idle.	B737 AOM Rev 9.0	Ch 18 §18.7.2 Operational Limits		unverified common limits verbatim
